{
  "name": "tool-selection-router",
  "version": "1.0.0",
  "description": "Select the best search, fetch, or scraping tool by intent with explicit fallback and escalation behavior.",
  "category": "research",
  "keywords": [
    "tool-selection",
    "routing",
    "search",
    "fetch",
    "research"
  ],
  "related_skills": [
    "research-capability",
    "mcp-manager"
  ],
  "related_workflows": [
    "/research",
    "/analyze"
  ]
}