{
  "name": "wf-security-audit",
  "version": "1.0.0",
  "description": "OpenAI Codex orchestration skill converted from security-audit.md. Use for security-audit workflow tasks.",
  "category": "productivity",
  "keywords": [
    "workflow",
    "orchestration",
    "security-audit",
    "openai",
    "codex",
    "security"
  ],
  "related_skills": [
    "security-checker"
  ]
}
