{
  "name": "wf-test-developer",
  "version": "1.0.0",
  "description": "OpenAI Codex orchestration skill converted from test-developer.md. Use for test-developer workflow tasks.",
  "category": "productivity",
  "keywords": [
    "workflow",
    "orchestration",
    "test-developer",
    "openai",
    "codex",
    "testing"
  ],
  "related_skills": [
    "test-generator"
  ]
}
