{
  "name": "documentation-generator",
  "version": "2.0.0",
  "description": "Generate maintainable project documentation from source code, architecture, and runtime behavior. Use when creating or updating README, API references, ADRs, deployment guides, or troubleshooting d...",
  "category": "documentation",
  "keywords": [
    "documentation",
    "readme",
    "api-docs",
    "adr",
    "deployment",
    "troubleshooting"
  ],
  "related_skills": [
    "api-builder",
    "architecture-planner"
  ],
  "related_workflows": [
    "/handoff",
    "/tutor"
  ]
}
