{
  "name": "mcp-builder",
  "version": "2.0.0",
  "description": "Create custom MCP tools from scratch. For combining existing MCP tools, use mcp-manager's code-mode feature instead. Use when no existing MCP server provides the required capability and a custom MC...",
  "category": "development",
  "keywords": [
    "mcp",
    "tools",
    "custom",
    "schema",
    "handlers",
    "development"
  ],
  "related_skills": [
    "docker-ops",
    "mcp-manager"
  ]
}
