{
  "name": "openai-rule-builder",
  "version": "1.0.0",
  "description": "Create and maintain OpenAI Codex-compatible Starlark command rules in default.rules.",
  "category": "security",
  "keywords": [
    "rules",
    "starlark",
    "codex",
    "prefix_rule",
    "openai",
    "policy"
  ],
  "related_skills": [
    "rule-builder",
    "skill-builder",
    "automation-builder"
  ]
}
