{
  "name": "api-builder",
  "version": "2.0.0",
  "description": "Design and build RESTful and GraphQL APIs with proper structure, validation, authentication, and documentation. Generates OpenAPI specs, endpoint handlers, and middleware. Use when creating new API...",
  "category": "development",
  "keywords": [
    "api",
    "rest",
    "graphql",
    "openapi",
    "endpoints",
    "swagger"
  ],
  "related_skills": [
    "architecture-planner",
    "code-reviewer",
    "test-generator"
  ]
}
