{
  "name": "wf-analyze",
  "version": "1.0.0",
  "description": "OpenAI Codex orchestration skill converted from analyze.md. Use for analyze workflow tasks.",
  "category": "productivity",
  "keywords": [
    "workflow",
    "orchestration",
    "analyze",
    "openai",
    "codex"
  ],
  "related_skills": [
    "performance-analyzer",
    "research-capability"
  ]
}
