{
  "name": "git-commit-generator",
  "version": "2.0.0",
  "description": "Generate conventional commit messages from staged changes. Analyzes diffs to create semantic, descriptive commit messages following Conventional Commits specification. Use when committing code chan...",
  "category": "productivity",
  "keywords": [
    "git",
    "commit",
    "conventional-commits",
    "changelog"
  ],
  "related_skills": [
    "ci-cd-debugger",
    "code-reviewer"
  ]
}
