{
  "name": "automation-builder",
  "version": "1.0.0",
  "description": "Build and maintain OpenAI Codex automation templates with schedule metadata and skill invocation.",
  "category": "productivity",
  "keywords": [
    "automation",
    "codex",
    "templates",
    "schedule",
    "openai",
    "skills"
  ],
  "related_skills": [
    "workflow-builder",
    "skill-builder",
    "openai-rule-builder"
  ]
}
