{
  "name": "archive-code",
  "version": "2.0.0",
  "description": "Create and inspect SCIP code indices for project archives. Use when you need precise symbol/navigation data for a codebase snapshot and want the index stored with the same project context for later...",
  "category": "research",
  "keywords": [
    "archive",
    "code-index",
    "scip",
    "symbols",
    "navigation",
    "sourcegraph"
  ],
  "related_skills": [
    "archive-git",
    "archive-graph",
    "archive-manager"
  ]
}
