{
  "name": "wf-onboard",
  "version": "1.0.0",
  "description": "OpenAI Codex orchestration skill converted from onboard.md. Use for onboard workflow tasks.",
  "category": "productivity",
  "keywords": [
    "workflow",
    "orchestration",
    "onboard",
    "openai",
    "codex"
  ],
  "related_skills": [
    "research-capability"
  ]
}
