{
  "name": "wf-morning",
  "version": "1.0.0",
  "description": "OpenAI Codex orchestration skill converted from morning.md. Use for morning workflow tasks.",
  "category": "productivity",
  "keywords": [
    "workflow",
    "orchestration",
    "morning",
    "openai",
    "codex"
  ],
  "related_skills": []
}
