{
  "name": "ci-cd-debugger",
  "version": "2.0.0",
  "description": "Debug failing CI/CD pipelines and GitHub Actions workflows. Analyzes build logs, identifies failure causes, and suggests fixes. Use when builds fail, tests break in CI, or deployments don't complet...",
  "category": "devops",
  "keywords": [
    "ci-cd",
    "github-actions",
    "pipeline",
    "debugging",
    "devops"
  ],
  "related_skills": [
    "docker-ops",
    "git-commit-generator",
    "test-generator"
  ]
}
