{
  "name": "rule-builder",
  "version": "2.0.0",
  "description": "Create or update reusable agent behavior rules with explicit constraints, activation modes, and install paths. Use when enforcing consistent guardrails (security, style, workflow) across a workspac...",
  "category": "productivity",
  "keywords": [
    "rules",
    "constraints",
    "guardrails",
    "GEMINI.md",
    "agent behavior"
  ]
}
