{
  "name": "code-reviewer",
  "version": "2.0.0",
  "description": "Automated code review for pull requests and code changes. Identifies bugs, security vulnerabilities, performance issues, and style violations. Use when reviewing PRs, before merging code, or when r...",
  "category": "development",
  "keywords": [
    "code-review",
    "pr",
    "pull-request",
    "security",
    "bugs"
  ],
  "related_skills": [
    "architecture-planner",
    "git-commit-generator",
    "Invoke for auth, input handling, or API changes",
    "test-generator"
  ]
}
