{
  "name": "wf-handoff",
  "version": "1.0.0",
  "description": "OpenAI Codex orchestration skill converted from handoff.md. Use for handoff workflow tasks.",
  "category": "productivity",
  "keywords": [
    "workflow",
    "orchestration",
    "handoff",
    "openai",
    "codex"
  ],
  "related_skills": []
}
