{
  "name": "wf-code",
  "version": "1.0.0",
  "description": "OpenAI Codex orchestration skill converted from code.md. Use for code workflow tasks.",
  "category": "productivity",
  "keywords": [
    "workflow",
    "orchestration",
    "code",
    "openai",
    "codex"
  ],
  "related_skills": [
    "code-reviewer",
    "research-capability"
  ]
}
