{
  "name": "archive-memory",
  "version": "2.0.0",
  "description": "Persist structured project context in a local SQLite memory store. Use when recording decisions, patterns, and durable notes that should survive across sessions and remain queryable by category or...",
  "category": "productivity",
  "keywords": [
    "archive",
    "memory",
    "sqlite",
    "context",
    "decisions",
    "persistence"
  ],
  "related_skills": [
    "archive-manager",
    "documentation-generator",
    "research-capability"
  ]
}
