{
  "name": "wf-pr",
  "version": "1.0.0",
  "description": "OpenAI Codex orchestration skill converted from pr.md. Use for pr workflow tasks.",
  "category": "productivity",
  "keywords": [
    "workflow",
    "orchestration",
    "pr",
    "openai",
    "codex"
  ],
  "related_skills": [
    "code-reviewer"
  ]
}
