{
  "name": "workspace-rules-bootstrapper",
  "version": "1.0.0",
  "description": "Generate project-scoped workspace rules from stack profile inputs during project setup.",
  "category": "development",
  "keywords": [
    "workspace-rules",
    "bootstrap",
    "project-setup",
    "policy"
  ],
  "related_skills": [
    "rule-builder",
    "architecture-planner"
  ],
  "related_workflows": [
    "/project-setup",
    "/architect"
  ]
}