{
  "name": "architecture-planner",
  "version": "2.0.0",
  "description": "Design and document software architecture with diagrams and specifications. Generates Mermaid diagrams for system design, data flow, and component relationships. Use when planning new features, doc...",
  "category": "architecture",
  "keywords": [
    "architecture",
    "design",
    "mermaid",
    "diagrams",
    "system-design"
  ],
  "related_skills": [
    "code-reviewer",
    "test-generator"
  ]
}
