{
  "name": "wf-fix-issue",
  "version": "1.0.0",
  "description": "OpenAI Codex orchestration skill converted from fix-issue.md. Use for fix-issue workflow tasks.",
  "category": "productivity",
  "keywords": [
    "workflow",
    "orchestration",
    "fix-issue",
    "openai",
    "codex"
  ],
  "related_skills": [
    "git-commit-generator",
    "test-generator"
  ]
}
