{
  "name": "wf-project-setup",
  "version": "1.0.0",
  "description": "OpenAI Codex orchestration skill converted from project-setup.md. Use for project-setup workflow tasks.",
  "category": "productivity",
  "keywords": [
    "workflow",
    "orchestration",
    "project-setup",
    "openai",
    "codex"
  ],
  "related_skills": [
    "architecture-planner",
    "rule-builder"
  ]
}
